<?xml version="1.0" encoding="UTF-8"?>
<ins:InsuranceReturn xmlns:ins="urn:naicom:insurance:reporting:v1"
                     xmlns:xsi="http://www.w3.org/2001/XMLSchema-instance"
                     xsi:schemaLocation="urn:naicom:insurance:reporting:v1 Insurance_Return_Schema_v1.0.xsd"
                     schemaVersion="1.0">

  <ins:Header>
    <ins:NAICOMRegNo>INS/2024/00123</ins:NAICOMRegNo>
    <ins:InsurerName>Sample Insurance Company Nigeria Limited</ins:InsurerName>
    <ins:ReturnType>SOL</ins:ReturnType>
    <ins:InsurerCategory>Composite</ins:InsurerCategory>
    <ins:ReportingPeriodStart>2026-01-01</ins:ReportingPeriodStart>
    <ins:ReportingPeriodEnd>2026-03-31</ins:ReportingPeriodEnd>
    <ins:SubmissionDateTime>2026-04-28T14:30:00Z</ins:SubmissionDateTime>
    <ins:ContactPerson>Ngozi Eze</ins:ContactPerson>
    <ins:ContactEmail>returns@sampleinsurance.com.ng</ins:ContactEmail>
    <ins:ContactPhone>+234-1-234-5678</ins:ContactPhone>
  </ins:Header>

  <ins:SolvencyMargin>
    <ins:AdmissibleAsset>
      <ins:AssetCategory>FGN Securities (T-Bills and Bonds)</ins:AssetCategory>
      <ins:GrossValue>12500000.00</ins:GrossValue>
      <ins:AdmissibilityPct>100.00</ins:AdmissibilityPct>
      <ins:AdmittedValue>12500000.00</ins:AdmittedValue>
    </ins:AdmissibleAsset>
    <ins:AdmissibleAsset>
      <ins:AssetCategory>Cash and Bank Balances</ins:AssetCategory>
      <ins:GrossValue>3200000.00</ins:GrossValue>
      <ins:AdmissibilityPct>100.00</ins:AdmissibilityPct>
      <ins:AdmittedValue>3200000.00</ins:AdmittedValue>
    </ins:AdmissibleAsset>
    <ins:AdmissibleAsset>
      <ins:AssetCategory>Quoted Equities</ins:AssetCategory>
      <ins:GrossValue>5800000.00</ins:GrossValue>
      <ins:AdmissibilityPct>100.00</ins:AdmissibilityPct>
      <ins:AdmittedValue>5800000.00</ins:AdmittedValue>
    </ins:AdmissibleAsset>
    <ins:AdmissibleAsset>
      <ins:AssetCategory>Investment Properties</ins:AssetCategory>
      <ins:GrossValue>4500000.00</ins:GrossValue>
      <ins:AdmissibilityPct>90.00</ins:AdmissibilityPct>
      <ins:AdmittedValue>4050000.00</ins:AdmittedValue>
    </ins:AdmissibleAsset>
    <ins:AdmissibleAsset>
      <ins:AssetCategory>Corporate Bonds</ins:AssetCategory>
      <ins:GrossValue>2800000.00</ins:GrossValue>
      <ins:AdmissibilityPct>90.00</ins:AdmissibilityPct>
      <ins:AdmittedValue>2520000.00</ins:AdmittedValue>
    </ins:AdmissibleAsset>
    <ins:AdmissibleAsset>
      <ins:AssetCategory>Statutory Deposit with CBN</ins:AssetCategory>
      <ins:GrossValue>2500000.00</ins:GrossValue>
      <ins:AdmissibilityPct>100.00</ins:AdmissibilityPct>
      <ins:AdmittedValue>2500000.00</ins:AdmittedValue>
    </ins:AdmissibleAsset>

    <ins:TotalAdmissibleAssets>30570000.00</ins:TotalAdmissibleAssets>
    <ins:TotalLiabilities>18200000.00</ins:TotalLiabilities>
    <ins:AvailableCapital>12370000.00</ins:AvailableCapital>
    <ins:MCR>25000000.00</ins:MCR>
    <ins:SolvencyMarginRatio>122.28</ins:SolvencyMarginRatio>
    <ins:IsCompliant>true</ins:IsCompliant>
  </ins:SolvencyMargin>

  <ins:Signature>
    <ins:PreparedBy>
      <ins:Name>Chukwuma Obi</ins:Name>
      <ins:Designation>Head, Financial Reporting</ins:Designation>
      <ins:Date>2026-04-25</ins:Date>
    </ins:PreparedBy>
    <ins:CEOSignOff>
      <ins:Name>Adebayo Johnson</ins:Name>
      <ins:Designation>Managing Director / CEO</ins:Designation>
      <ins:Date>2026-04-28</ins:Date>
    </ins:CEOSignOff>
    <ins:CFOSignOff>
      <ins:Name>Fatima Ibrahim</ins:Name>
      <ins:Designation>Chief Financial Officer</ins:Designation>
      <ins:Date>2026-04-28</ins:Date>
    </ins:CFOSignOff>
    <ins:CertificationStatement>I/We certify that the information provided is true, accurate, and complete to the best of our knowledge and in compliance with NAICOM prudential guidelines and the NIIRA 2025.</ins:CertificationStatement>
  </ins:Signature>

</ins:InsuranceReturn>
